{
  "schema_version": 1,
  "source": {
    "sha256": "31ce6eacb36f0b9579aa5395508da34b2acddf665235515a845dfcbc91cfe552",
    "bytes": 252416,
    "file_name": "Cylinder.ipt"
  },
  "provider": {
    "name": "synthetic",
    "version": "test-1",
    "platform": "test",
    "collector_sha256": "bbbbbbbbbbbbbbbbbbbbbbbbbbbbbbbbbbbbbbbbbbbbbbbbbbbbbbbbbbbbbbbb"
  },
  "capture": {
    "acquired_at": "2026-09-09T00:00:00Z",
    "scope": "synthetic",
    "model_state": null,
    "source_modified": false,
    "update_performed": false
  },
  "document": {
    "kind": "part",
    "internal_name": null,
    "properties": [],
    "references": [],
    "diagnostics": []
  },
  "geometry": {
    "status": "available",
    "units": "mm",
    "body_count": 1,
    "solid_count": 1,
    "faces": 3,
    "volume_mm3": 4908.738521234052,
    "area_mm2": 1767.1458676442585,
    "bbox_mm": [
      -12.5,
      0.0,
      -12.5,
      12.5,
      10.0,
      12.5
    ],
    "bbox_kind": "precise"
  },
  "limitations": [
    "Synthetic pipeline test derived from existing analytic regression values; not an independent vendor oracle."
  ]
}
